indicator_id,category,name,source,description
I1084,Sensitivity,Population vulnerability to heat waves,"Indicators such as heat-related mortality rates and the heat vul nerability index (HVI) are examples of population vulnerability index. These indexes consider various factors, such as age, health status and mortality due to other diseases, in addition to heat stress for calculation.
However,it is challenging to gather all the data required for the calculation at the city at national level. See Wolf and McGregor (2013, https://doi.org/10.1016/j.wace.2013.07.004) for methodological approach to calculating HVI in their work. https://www.sciencedirect.com/science/article/pii/S2212094713000054?via%3Dihub

https://climate-adapt.eea.europa.eu/en/metadata/indicators/vulnerability-to-extremes-of-heat","Level of vulnerability of populations to a heat wave aggravated by the potential UHI (urban heat island) effect - Use I1085, I1086, I1087and I1088"
I1085,Sensitivity,LCZ vulnerability level,"Local climate zones (LCZs) are a classification of a city’s block geometry and land cover in view of the effects on the local urban climate(Jiaetal.2024).The concept of LCZs has contributed to a better understanding and comparability of the intensity of UHI (Stewart and Oke2012),as this concept can be useful for various urban climate or microclimate variables (source: Patel et al 2025 https://doi.org/10.1002/cli2.70009).
See:
https://doi.org/10.1007/s11783-017-0984-9
https://doi.org/10.3390/ijgi10080539
https://doi.org/10.3390/su12198083
https://doi.org/10.1109/JSTARS.2012.2189873

https://doi.org/10.3390/su11072032

https://en.institutparisregion.fr/know-how/environment/vulnerability-of-towns-and-cities-to-rising-temperatures-assessed-using-the-local-climate-zones/",Vulnerability class of the unit of analysis to urban heat islands in relation to the local climate zone class to which it belongs
I1086,Sensitivity,Share of vulnerable population,"https://www.icos-cp.eu/news-and-events/news/european-cities-heatwaves-hit-most-vulnerable

https://iopscience.iop.org/article/10.1088/1748-9326/adbcc8/meta",Percentage of population sensitive to heat waves (under 5 and over 65 years old)
I1087,Sensitivity,Poverty rate,"https://www.icos-cp.eu/news-and-events/news/european-cities-heatwaves-hit-most-vulnerable

https://iopscience.iop.org/article/10.1088/1748-9326/adbcc8/meta",Rate of low-income households
I1088,Adaptive Capacity,Accessibility to cooling areas,,Proportion of the population with access to a cooling area nearby (less than 10 minutes' walk)
I1089,Sensitivity,Quality and structure of the green network,"https://www.forestresearch.gov.uk/tools-and-resources/fthr/urban-regeneration-and-greenspace-partnership/planning-integrated-landscapes/urban-green-networks-corridors-and-linkages/

https://environment.ec.europa.eu/topics/nature-and-biodiversity/green-infrastructure_en

https://www.sciencedirect.com/science/article/abs/pii/S0169204619303299","This index is a weighted sum of most relevant biodiversity indicators such as share of green, canopy and herbaceous area as well as connectivity and distance between canopy areas - Use I1090, I1091, I1092 and I1093"
I1090,Sensitivity,Share of green area,"The indicator green cover indicates the proportion of public green spaces covering the entire city or a district (with a recommended target of 30%–40%). This 30%–40% of green coverin the form of public and private green spaces would contribute to a significant air temperature reduction in cities. This indicator is calculated using the total area of all green spaces available under the atmospheric canopy in proportion to the total area of land (Patel et al 2025, https://doi.org/10.1002/cli2.70009).

Additional sources:
Zhao, C., G. Fu, X. Liu, and F. Fu. 2011. “Urban Planning Indicators,
Morphology and Climate Indicators: A Case Study for a North-South
TransectofBeijing,China.”BuildingandEnvironment46,no.5:1174–1183.
https://doi.org/10.1016/j.buildenv.2010.12.009",Percentage of the surface area of the unit of analysis occupied by vegetation (private and public spaces combined)
I1091,Sensitivity,Share of canopy area,"The urban canopy layer height has a significant effect on UHI. The study done by Zauli Sajani et al. (2008) mentioned that the canopy layer height temperature measurements generally underestimate the values of UHI compared to the 10- and 2- m temperature measurement stations. However, canopy layer height measurements fo rurban climate studies are not common, though they provide significant information for understanding the UHI effects (MaShaoXiuetal.2017) (Patel et al 2025, https://doi.org/10.1002/cli2.70009).
Sources:
https://doi.org/10.1007/s00484-008-0171-6
https://www.cabidigitallibrary.org/doi/full/10.5555/20183020539",Percentage of the surface area of the unit of analysis occupied by wooded vegetation (private and public spaces combined) also called canopy index
I1092,Sensitivity,Share of herbaceous area,,Percentage of the surface area of the analysis unit occupied by low vegetation like shrub and grassland (private and public spaces combined)
I1093,Sensitivity,Mean distance between canopy areas,,Distance as the crow flies between canopy areas and their nearest neighbours in the unit of analysis under consideration
I1094,Adaptive Capacity,Urban vegetation and well-being,"https://pubmed.ncbi.nlm.nih.gov/35856464/

https://www.eea.europa.eu/publications/who-benefits-from-nature-in

https://www.sciencedirect.com/science/article/pii/S2542519621002291

https://urbact.eu/articles/access-nature-cities-improves-health-and-boosts-well-being

https://www.sciencedirect.com/science/article/abs/pii/S1618866721001308","This index is a weighted sum of most relevant well-being (related to vegetation) indicators such as green, canopy and public green areas per capita as well as accessibility to public green spaces (I1095, I1096, I1097,I1099,I1099)"
I1095,Adaptive Capacity,Green area per capita,"https://www.sciencedirect.com/science/article/pii/S2542519621002291

https://www.sciencedirect.com/science/article/abs/pii/S1618866721001308


https://pubmed.ncbi.nlm.nih.gov/35856464/",Average area of green space per inhabitant per analysis unit
I1096,Adaptive Capacity,Area of public green spaces per capita,"https://urbact.eu/articles/access-nature-cities-improves-health-and-boosts-well-being

https://www.sciencedirect.com/science/article/abs/pii/S1618866721001308",Average area of public green space per inhabitant per analysis unit
I1097,Adaptive Capacity,Canopy area per capita,https://efi.int/news/new-efi-policy-brief-explores-how-trees-and-urban-forests-combat-health-problems-2024-07-09,Average area of canopy (surface area of trees seen from the sky) per inhabitant per unit of analysis
I1098,Adaptive Capacity,Share of public green spaces,"https://urbact.eu/articles/access-nature-cities-improves-health-and-boosts-well-being

https://www.sciencedirect.com/science/article/abs/pii/S1618866721001308",Percentage of the surface area of the analysis unit made up of public green spaces
I1099,Adaptive Capacity,Accessiblity to public green spaces,"This indicator provides information about how much public green space is available in the walking distance of 300–500m for citizens.
Source
Nieuwenhuijsen,M.J., P.Dadvand, S.Márquez, et al. 2022. “The Evaluation of the 3-30-300 Green Space Rule and Mental Health.” Environmental Research 215:114387. https://doi.org/10.1016/j.envres.2022.114387.

https://urbact.eu/articles/access-nature-cities-improves-health-and-boosts-well-being

https://www.sciencedirect.com/science/article/abs/pii/S1618866721001308",Proportion of the population with access to a relatively large public green space (over 5000m²) nearby (less than 10 minutes' walk)
I1100,Exposure,Land Surface temperature,"https://doi.org/10.5066/P9OGBGM6

downloaded on:
https://earthexplorer.usgs.gov/",Mean Land surface temperature  in the unit of analysis under consideration
